{
  "$schema": "./schemas/dialog_base_schema.json",
  "title": "確認ダイアログ",
  "width": 250,
  "height": 120,
  "controls": [
    {
      "id": "message_label",
      "type": "label",
      "x": 20,
      "y": 30,
      "width": 210,
      "height": 20,
      "text": "この操作を実行しますか？",
      "color": 7
    },
    {
      "id": "ok_button",
      "type": "button",
      "x": 50,
      "y": 70,
      "width": 60,
      "height": 25,
      "text": "OK",
      "color": 7,
      "bg_color": 11,
      "hover_color": 3,
      "events": ["click"]
    },
    {
      "id": "cancel_button",
      "type": "button",
      "x": 140,
      "y": 70,
      "width": 60,
      "height": 25,
      "text": "Cancel",
      "color": 7,
      "bg_color": 8,
      "hover_color": 2,
      "events": ["click"]
    }
  ]
}
